{
  "period_start": "2026-09-21",
  "period_end": "2026-09-27",
  "net_benefit_simulated": {
    "assumptions": {
      "period": "week 2026-09-21 to 2026-09-27, all decisions",
      "logistics_returns_avoided": 18,
      "logistics_cost_per_return_eur": 8.0,
      "undue_discounts_avoided": 6,
      "avg_undue_discount_eur": 12.0,
      "minutes_saved": 95.0,
      "hourly_cost_eur": 22.0,
      "incentives_eur": 41.0,
      "system_cost_eur": 28.0,
      "error_cost_eur": 23.0,
      "abandonment_margin_lost_eur": 55.0,
      "incremental_margin_eur": 37.0,
      "version": "kpi/2026-09-21",
      "basis": "simulated",
      "based_on": "assumptions-v1"
    },
    "components": [
      {
        "id": "logistics_costs_avoided",
        "amount": {
          "value": 144.0,
          "unit": "eur",
          "provenance": {
            "origin": "Contract example: economic simulator on the decisions of one week, assumptions-v1",
            "period_start": "2026-09-21",
            "period_end": "2026-09-27",
            "nature": "simulated"
          }
        }
      },
      {
        "id": "undue_discounts_avoided",
        "amount": {
          "value": 72.0,
          "unit": "eur",
          "provenance": {
            "origin": "Contract example: economic simulator on the decisions of one week, assumptions-v1",
            "period_start": "2026-09-21",
            "period_end": "2026-09-27",
            "nature": "simulated"
          }
        }
      },
      {
        "id": "time_saved_value",
        "amount": {
          "value": 34.83,
          "unit": "eur",
          "provenance": {
            "origin": "Contract example: economic simulator on the decisions of one week, assumptions-v1",
            "period_start": "2026-09-21",
            "period_end": "2026-09-27",
            "nature": "simulated"
          }
        }
      },
      {
        "id": "incremental_margin",
        "amount": {
          "value": 37.0,
          "unit": "eur",
          "provenance": {
            "origin": "Contract example: economic simulator on the decisions of one week, assumptions-v1",
            "period_start": "2026-09-21",
            "period_end": "2026-09-27",
            "nature": "simulated"
          }
        }
      },
      {
        "id": "incentives",
        "amount": {
          "value": -41.0,
          "unit": "eur",
          "provenance": {
            "origin": "Contract example: economic simulator on the decisions of one week, assumptions-v1",
            "period_start": "2026-09-21",
            "period_end": "2026-09-27",
            "nature": "simulated"
          }
        }
      },
      {
        "id": "system_cost",
        "amount": {
          "value": -28.0,
          "unit": "eur",
          "provenance": {
            "origin": "Contract example: economic simulator on the decisions of one week, assumptions-v1",
            "period_start": "2026-09-21",
            "period_end": "2026-09-27",
            "nature": "simulated"
          }
        }
      },
      {
        "id": "error_cost",
        "amount": {
          "value": -23.0,
          "unit": "eur",
          "provenance": {
            "origin": "Contract example: economic simulator on the decisions of one week, assumptions-v1",
            "period_start": "2026-09-21",
            "period_end": "2026-09-27",
            "nature": "simulated"
          }
        }
      },
      {
        "id": "abandonment_margin_lost",
        "amount": {
          "value": -55.0,
          "unit": "eur",
          "provenance": {
            "origin": "Contract example: economic simulator on the decisions of one week, assumptions-v1",
            "period_start": "2026-09-21",
            "period_end": "2026-09-27",
            "nature": "simulated"
          }
        }
      }
    ],
    "total": {
      "value": 140.83,
      "unit": "eur",
      "provenance": {
        "origin": "Contract example: economic simulator on the decisions of one week, assumptions-v1",
        "period_start": "2026-09-21",
        "period_end": "2026-09-27",
        "nature": "simulated"
      }
    }
  },
  "net_benefit_realized": null,
  "evaluation_report_id": "eval-2026-09-30",
  "false_positives": [
    {
      "cohort": "all",
      "false_positive_rate": {
        "value": 0.021,
        "unit": "ratio",
        "provenance": {
          "origin": "Contract example: offline evaluation report eval-2026-09-30 on synthetic labels, test months",
          "period_start": "2026-07-01",
          "period_end": "2026-09-30",
          "nature": "synthetic"
        }
      },
      "customers": {
        "value": 4180,
        "unit": "count",
        "provenance": {
          "origin": "Contract example: offline evaluation report eval-2026-09-30 on synthetic labels, test months",
          "period_start": "2026-07-01",
          "period_end": "2026-09-30",
          "nature": "synthetic"
        }
      }
    },
    {
      "cohort": "new_customers",
      "false_positive_rate": {
        "value": 0.034,
        "unit": "ratio",
        "provenance": {
          "origin": "Contract example: offline evaluation report eval-2026-09-30 on synthetic labels, test months",
          "period_start": "2026-07-01",
          "period_end": "2026-09-30",
          "nature": "synthetic"
        }
      },
      "customers": {
        "value": 610,
        "unit": "count",
        "provenance": {
          "origin": "Contract example: offline evaluation report eval-2026-09-30 on synthetic labels, test months",
          "period_start": "2026-07-01",
          "period_end": "2026-09-30",
          "nature": "synthetic"
        }
      }
    },
    {
      "cohort": "households",
      "false_positive_rate": {
        "value": 0.028,
        "unit": "ratio",
        "provenance": {
          "origin": "Contract example: offline evaluation report eval-2026-09-30 on synthetic labels, test months",
          "period_start": "2026-07-01",
          "period_end": "2026-09-30",
          "nature": "synthetic"
        }
      },
      "customers": {
        "value": 702,
        "unit": "count",
        "provenance": {
          "origin": "Contract example: offline evaluation report eval-2026-09-30 on synthetic labels, test months",
          "period_start": "2026-07-01",
          "period_end": "2026-09-30",
          "nature": "synthetic"
        }
      }
    },
    {
      "cohort": "low_data",
      "false_positive_rate": {
        "value": 0.041,
        "unit": "ratio",
        "provenance": {
          "origin": "Contract example: offline evaluation report eval-2026-09-30 on synthetic labels, test months",
          "period_start": "2026-07-01",
          "period_end": "2026-09-30",
          "nature": "synthetic"
        }
      },
      "customers": {
        "value": 388,
        "unit": "count",
        "provenance": {
          "origin": "Contract example: offline evaluation report eval-2026-09-30 on synthetic labels, test months",
          "period_start": "2026-07-01",
          "period_end": "2026-09-30",
          "nature": "synthetic"
        }
      }
    },
    {
      "cohort": "high_value",
      "false_positive_rate": {
        "value": 0.009,
        "unit": "ratio",
        "provenance": {
          "origin": "Contract example: offline evaluation report eval-2026-09-30 on synthetic labels, test months",
          "period_start": "2026-07-01",
          "period_end": "2026-09-30",
          "nature": "synthetic"
        }
      },
      "customers": {
        "value": 1254,
        "unit": "count",
        "provenance": {
          "origin": "Contract example: offline evaluation report eval-2026-09-30 on synthetic labels, test months",
          "period_start": "2026-07-01",
          "period_end": "2026-09-30",
          "nature": "synthetic"
        }
      }
    }
  ],
  "decision_time_p50": {
    "value": 41.0,
    "unit": "seconds",
    "provenance": {
      "origin": "Contract example: decisions and audit log of the demo week",
      "period_start": "2026-09-21",
      "period_end": "2026-09-27",
      "nature": "synthetic"
    }
  },
  "decision_time_p95": {
    "value": 118.0,
    "unit": "seconds",
    "provenance": {
      "origin": "Contract example: decisions and audit log of the demo week",
      "period_start": "2026-09-21",
      "period_end": "2026-09-27",
      "nature": "synthetic"
    }
  },
  "abstentions_insufficient_evidence": {
    "value": 9,
    "unit": "count",
    "provenance": {
      "origin": "Contract example: decisions and audit log of the demo week",
      "period_start": "2026-09-21",
      "period_end": "2026-09-27",
      "nature": "synthetic"
    }
  },
  "abstention_rate": {
    "value": 0.0703,
    "unit": "ratio",
    "provenance": {
      "origin": "Contract example: decisions and audit log of the demo week",
      "period_start": "2026-09-21",
      "period_end": "2026-09-27",
      "nature": "synthetic"
    }
  },
  "decisions": {
    "total": {
      "value": 128,
      "unit": "count",
      "provenance": {
        "origin": "Contract example: decisions and audit log of the demo week",
        "period_start": "2026-09-21",
        "period_end": "2026-09-27",
        "nature": "synthetic"
      }
    },
    "approved": {
      "value": 97,
      "unit": "count",
      "provenance": {
        "origin": "Contract example: decisions and audit log of the demo week",
        "period_start": "2026-09-21",
        "period_end": "2026-09-27",
        "nature": "synthetic"
      }
    },
    "overridden": {
      "value": 6,
      "unit": "count",
      "provenance": {
        "origin": "Contract example: decisions and audit log of the demo week",
        "period_start": "2026-09-21",
        "period_end": "2026-09-27",
        "nature": "synthetic"
      }
    },
    "rejected": {
      "value": 2,
      "unit": "count",
      "provenance": {